<?xml version="1.0" encoding="UTF-8"?>
<!DOCTYPE pn SYSTEM "pn.dtd">
<pn>
    <cabecalho>
        <estado></estado>
        <pai>
            <url></url>
            <nome></nome>
        </pai>
        <codigo></codigo>
        <titulo></titulo>
    </cabecalho>
    <descritivo>
        <descricao></descricao>
        <naplicacao>
            <nota></nota>
        </naplicacao>
        <eaplicacao>
            <exemplo></exemplo>
        </eaplicacao>
        <nexclusao>
            <exclusao>
                <nota></nota>
                <url></url>
                <nome></nome>
            </exclusao>
        </nexclusao>
        <termos>
            <termo></termo>
        </termos>
    </descritivo>
    <contexto>
        <tipo></tipo>
        <transversal></transversal>
        <donos>
            <dono>
                <sigla></sigla>
                <nome></nome>
            </dono>
        </donos>
        <tintervencao>
            <comunicar>
                <participante>
                    <sigla></sigla>
                    <nome></nome>
                </participante>
            </comunicar>
            <iniciar>
                <participante>
                    <sigla></sigla>
                    <nome></nome>
                </participante>
            </iniciar>
        </tintervencao>
        <relacionados>
            <antecessor>
                <processo>
                    <url></url>
                    <nome></nome>
                </processo>
            </antecessor>
            <sintese>
                <processo>
                    <url></url>
                    <nome></nome>
                </processo>
            </sintese>
            <sintetizado>
                <processo>
                    <url></url>
                    <nome></nome>
                </processo>
            </sintetizado>
            <sucessor>
                <processo>
                    <url></url>
                    <nome></nome>
                </processo>
            </sucessor>
            <suplemento>
                <processo>
                    <url></url>
                    <nome></nome>
                </processo>
            </suplemento>
            <suplementop>
                <processo>
                    <url></url>
                    <nome></nome>
                </processo>
            </suplementop>
        </relacionados>
        <legislacao>
            <legis>
                <tipo></tipo>
                <artigo></artigo>
                <definicao></definicao>
            </legis>
        </legislacao>
    </contexto>
    <decisoes>
        <prazoca>
            <prazo></prazo>
            <forma></forma>
            <justificacao>
                <para>
                    <titulo></titulo>
                    <p></p>
                </para>
            </justificacao>
        </prazoca>
        <destinof>
            <destino></destino>
            <justificacao>
                <para>
                    <titulo></titulo>
                    <p></p>
                </para>
            </justificacao>
        </destinof>
    </decisoes>
</pn>